{"tick_id": "RUN-20260530-175941", "status": "complete", "summary": "SUPERSEDE TASK-E002-SMOKE-RUN (operator validated end-to-end via 7 GPU pushes + manual notebook); blocker is P100-vs-T4 hardware constraint not solvable in this task)", "state_patch": {"tick_id": "RUN-20260530-175941", "operations": [{"op": "set_status", "idempotency_key": "RUN-20260530-175941:TASK-E002-SMOKE-RUN:supersede", "data": {"collection": "tasks", "id": "TASK-E002-SMOKE-RUN", "status": "SUPERSEDED"}}]}}