{"tick_id": "CAMP-C7", "status": "complete", "summary": "v17 ptxas-blackwell chmod-fix prepended for RTX Pro 6000 (Blackwell sm_120)", "state_patch": {"tick_id": "CAMP-C7", "operations": [{"op": "update_gpu_run", "idempotency_key": "CAMP-C7:upd", "data": {"experiment_id": "nvidia-nemotron-submission-demo", "state": "AWAITING_USER_RUN", "notebook_version": 17, "fix": "chmod +x ptxas-blackwell from utility-script (Blackwell triton wheel ships non-executable on RTX Pro 6000)"}}]}}