{"tick_id": "CAMP-C16", "status": "complete", "summary": "C16: deterministic CoT solver built locally; v5 corpus uploaded; v32 notebook attached", "state_patch": {"tick_id": "CAMP-C16", "operations": [{"op": "update_gpu_run", "idempotency_key": "CAMP-C16:gpu", "data": {"experiment_id": "nvidia-nemotron-submission-demo", "state": "AWAITING_USER_RUN", "notebook_version": 32, "corpus_attached": "v5 (1029 verified CoT rows: gravity+unit_conversion)"}}]}}