{"tick_id": "CAMP-RESEARCH-1", "status": "complete", "summary": "campaign: parallel CPU-only research+corpus tasks while GPU is blocked", "state_patch": {"tick_id": "CAMP-RESEARCH-1", "operations": [{"op": "create_hypothesis", "idempotency_key": "CAMP-RESEARCH-1:H-PARALLEL-RESEARCH", "data": {"id": "H-PARALLEL-RESEARCH", "title": "Parallel CPU-only research while GPU is blocked accelerates the loop without using submit-cap", "statement": "While the GPU iteration is single-threaded (we wait on browser Save&Run All), 4 parallel Jules sessions can mine top notebooks, dig through 200+ discussions, synthesize CoT corpus, and gap-analyze vs winner \u2014 all CPU-only, all producing concrete analysis/data files the operator reads on next cycle to inform the next code push and the next training experiment.", "expected_effect": "Decouples campaign throughput from the GPU bottleneck. Each research task produces a concrete file that influences the next code push. Most impactful: the CoT corpus (winner's 0.65->0.85 lever).", "how_to_test": "All 4 tasks ship files within ~2h; next code push uses findings from at least 1 of them.", "source_refs": ["references/technique-backlog.md", "references/analysis-winner.md", "210 discussion-*.md files"], "status": "PROPOSED", "created_at": "2026-05-31T01:00:00Z"}}, {"op": "create_task", "idempotency_key": "CAMP-RESEARCH-1:TASK-RESEARCH-mine-top-notebooks", "data": {"id": "TASK-RESEARCH-mine-top-notebooks", "title": "Mine top 5 public NVIDIA Nemotron notebooks for techniques + write side-by-side comparison", "spec": "Read the top 5 most-upvoted public notebooks on the NVIDIA Nemotron Model Reasoning Challenge (use tools/kaggle_lite.py search_notebooks or competition page). For each notebook extract: (a) data prep + corpus path, (b) model load (4-bit vs bf16, device_map, max_memory), (c) LoRA config (rank/alpha/target_modules/dropout), (d) training loop (epochs, batch, accumulation, lr schedule, mask strategy), (e) inference template (chat format, max_new_tokens, temperature, boxed extraction), (f) special tricks (curriculum, log-prob filter, select2reason, etc.). Top candidates: ryanholbrook/nvidia-nemotron-submission-demo, asalhi/tinker-adapter-to-ready-to-submit-adapter, dennisfong/nvidia-nemotron-sfttrainer-training, kienngx/nvidia-nemotron-trained-models-submission, kienngx/nvidia-nemotron-training-cot-labels. Output: competitions/nvidia-nemotron-model-reasoning-challenge/analysis/top_notebooks_v1.md with a markdown table comparing all 5 + a ranked list of the top 5 techniques our current notebook_fork_working.ipynb is MISSING. Cite each technique with the notebook ref + line. Acceptance: file exists with >=5 notebooks compared + >=5 missing techniques identified.", "allowed_area": "competitions/nvidia-nemotron-model-reasoning-challenge/analysis/top_notebooks_v1.md", "priority": "P0", "est_hours": 1.0, "status": "BACKLOG", "hypothesis_id": "H-PARALLEL-RESEARCH", "created_at": "2026-05-31T01:00:00Z"}}, {"op": "create_task", "idempotency_key": "CAMP-RESEARCH-1:TASK-RESEARCH-mine-discussions", "data": {"id": "TASK-RESEARCH-mine-discussions", "title": "Mine 200+ discussions for ranked actionable insights", "spec": "Read all discussion threads under competitions/nvidia-nemotron-model-reasoning-challenge/references/ (files discussion-*.md). Extract every actionable technique, gotcha, eval tip, GPU/memory trick, and submission-format insight. Categorize into: TRAIN_TRICK / DATA_TRICK / EVAL_TRICK / GPU_TIP / GOTCHA / SUBMIT_TIP. Rank by likely-impact-on-our-LB. Output: competitions/nvidia-nemotron-model-reasoning-challenge/analysis/discussions_insights_v1.md with: (a) top 20 insights ranked by expected delta, each citing source discussion file, (b) a 'fixes for our current notebook' section listing the 5 most-applicable ones with the exact code change to make. Acceptance: >=20 ranked insights + >=5 concrete code fixes citing line numbers in notebook_fork_working.ipynb.", "allowed_area": "competitions/nvidia-nemotron-model-reasoning-challenge/analysis/discussions_insights_v1.md", "priority": "P0", "est_hours": 1.5, "status": "BACKLOG", "hypothesis_id": "H-PARALLEL-RESEARCH", "created_at": "2026-05-31T01:00:00Z"}}, {"op": "create_task", "idempotency_key": "CAMP-RESEARCH-1:TASK-DATA-cot-corpus-v1", "data": {"id": "TASK-DATA-cot-corpus-v1", "title": "Build CoT corpus from train.csv using winner's deterministic solver pattern (the 0.65->0.85 lever)", "spec": "This is technique-backlog #1: the largest single CV-lever. Read references/analysis-winner.md + winner-reasoning.py.md + winner-corpus.py.md + winner-augmentation.py.md. Build competitions/nvidia-nemotron-model-reasoning-challenge/data/corpus/cot_v1.jsonl by: (a) loading data/raw/train.csv (run tools/download_competition_data.py if missing), (b) classifying each row into one of the 9 host categories using data/curation/classify.py, (c) for each row generating a step-by-step \\boxed{} chain-of-thought using a per-category deterministic solver (Python, NO LLM/API calls). Cover at least 6 of the 9 categories (equation_numeric, cryptarithm, cipher, bit_manipulation, numeral, gravity priorities). Output schema per line: {id, category, prompt, cot_completion, verified:bool}. Target: >=500 verified-CoT rows. Add tests/test_cot_corpus_v1.py asserting each output row has \\boxed{answer} matching the original train.csv answer (verification gate). Acceptance: corpus.jsonl exists with >=500 rows >=90 percent verified across >=6 categories; pytest -q green.", "allowed_area": "competitions/nvidia-nemotron-model-reasoning-challenge/data/corpus/, tests/test_cot_corpus_v1.py", "priority": "P0", "est_hours": 1.5, "status": "BACKLOG", "hypothesis_id": "H-PARALLEL-RESEARCH", "created_at": "2026-05-31T01:00:00Z"}}, {"op": "create_task", "idempotency_key": "CAMP-RESEARCH-1:TASK-RESEARCH-winner-vs-ours", "data": {"id": "TASK-RESEARCH-winner-vs-ours", "title": "Gap analysis: winner solution vs our current fork notebook", "spec": "Compare the winner's solution (per references/analysis-winner.md + analysis-winner-training-internals.md + all winner-*.md files) to our current notebook_fork_working.ipynb. Produce competitions/nvidia-nemotron-model-reasoning-challenge/analysis/winner_vs_current_v1.md with: (a) side-by-side table of every winner design decision vs ours (data, LoRA, optimizer, training loop, inference, eval, submission format), (b) top 10 ranked GAPS where we differ from winner, each with expected CV delta if closed and the exact code change for our notebook, (c) recommended next 3 experiments in priority order. Acceptance: >=10 gaps listed with expected deltas + code changes; explicit top-3 experiment recommendation with hypothesis.", "allowed_area": "competitions/nvidia-nemotron-model-reasoning-challenge/analysis/winner_vs_current_v1.md", "priority": "P0", "est_hours": 1.0, "status": "BACKLOG", "hypothesis_id": "H-PARALLEL-RESEARCH", "created_at": "2026-05-31T01:00:00Z"}}]}}