{"tick_id": "CAMP-C4", "status": "complete", "summary": "v9 pushed: bitsandbytes>=0.46.1 install as cell-0 + T4x2 max_memory split", "state_patch": {"tick_id": "CAMP-C4", "operations": [{"op": "update_gpu_run", "idempotency_key": "CAMP-C4:upd", "data": {"experiment_id": "nvidia-nemotron-submission-demo", "state": "AWAITING_USER_RUN", "notebook_version": 9, "fix": "bnb_version+max_memory"}}]}}