{"tick_id": "RUN-20260530-141526b", "status": "complete", "summary": "close E007-RESCOPE (already rescued); defer cron-trigger (user controls cadence)", "state_patch": {"tick_id": "RUN-20260530-141526b", "operations": [{"op": "set_status", "idempotency_key": "RUN-20260530-141526b:TASK-E007-RESCOPE:done", "data": {"collection": "tasks", "id": "TASK-E007-RESCOPE", "status": "DONE"}}, {"op": "set_status", "idempotency_key": "RUN-20260530-141526b:TASK-OPS-cron-trigger:defer", "data": {"collection": "tasks", "id": "TASK-OPS-cron-trigger", "status": "BACKLOG"}}]}}