{"tick_id": "CAMP-C12", "status": "complete", "summary": "C12: 3 PRs merged (host-spec + stratified + target-mask); v30 host-parity pushed", "state_patch": {"tick_id": "CAMP-C12", "operations": [{"op": "clear_session", "idempotency_key": "CAMP-C12:1647096689154526445:c", "data": {"session_id": "1647096689154526445"}}, {"op": "set_status", "idempotency_key": "CAMP-C12:TASK-EVAL-host-chat-template:d", "data": {"collection": "tasks", "id": "TASK-EVAL-host-chat-template", "status": "DONE"}}, {"op": "clear_session", "idempotency_key": "CAMP-C12:2705501700282755726:c", "data": {"session_id": "2705501700282755726"}}, {"op": "set_status", "idempotency_key": "CAMP-C12:TASK-NOTEBOOK-stratified-batching:d", "data": {"collection": "tasks", "id": "TASK-NOTEBOOK-stratified-batching", "status": "DONE"}}, {"op": "clear_session", "idempotency_key": "CAMP-C12:6748516039239083482:c", "data": {"session_id": "6748516039239083482"}}, {"op": "set_status", "idempotency_key": "CAMP-C12:TASK-NOTEBOOK-target-masking:d", "data": {"collection": "tasks", "id": "TASK-NOTEBOOK-target-masking", "status": "DONE"}}, {"op": "update_gpu_run", "idempotency_key": "CAMP-C12:gpu", "data": {"experiment_id": "nvidia-nemotron-submission-demo", "state": "AWAITING_USER_RUN", "notebook_version": 30, "fix": "v28/30 host-template parity (reasoning_on + boxed-suffix + enable_thinking + host gen params + step-LR + apply_chat_template masking)"}}]}}