{"tick_id": "CAMP-C2", "status": "complete", "summary": "campaign C2: pushed v4 with 4-bit-NF4 fallback for T4-sized GPUs", "state_patch": {"tick_id": "CAMP-C2", "operations": [{"op": "update_gpu_run", "idempotency_key": "CAMP-C2:upd", "data": {"experiment_id": "nvidia-nemotron-submission-demo", "state": "AWAITING_USER_RUN", "notebook_version": 4, "note": "v3 demo-code crashed on T4 OOM; v4 has 4-bit NF4 fallback"}}]}}