{"tick_id": "CAMP-C17", "status": "complete", "summary": "C17: v6 CoT corpus uploaded (gravity+unit+numeral); v34 notebook attached", "state_patch": {"tick_id": "CAMP-C17", "operations": [{"op": "update_gpu_run", "idempotency_key": "CAMP-C17:gpu", "data": {"experiment_id": "nvidia-nemotron-submission-demo", "state": "AWAITING_USER_RUN", "notebook_version": 34, "corpus_attached": "v5 + v6 (1569 verified CoT rows: gravity 529 + unit_conv 500 + numeral 540)"}}]}}