{"tick_id": "CAMP-C15", "status": "complete", "summary": "C15: corpus v2 uploaded as Kaggle dataset + attached to notebook v31", "state_patch": {"tick_id": "CAMP-C15", "operations": [{"op": "update_gpu_run", "idempotency_key": "CAMP-C15:gpu", "data": {"experiment_id": "nvidia-nemotron-submission-demo", "state": "AWAITING_USER_RUN", "notebook_version": 31, "fix": "corpus v2 uploaded to Kaggle dataset sai1881/nemotron-cot-corpus-v2; attached to notebook as dataSources entry \u2014 first time corpus is auto-mounted via /kaggle/input/"}}]}}