{"tick_id": "RUN-20260530-141526", "status": "complete", "summary": "clear 3 COMPLETED sessions (PRs #44/#45/#46 auto-merged)", "state_patch": {"tick_id": "RUN-20260530-141526", "operations": [{"op": "clear_session", "idempotency_key": "RUN-20260530-141526:11091484301140930622:clear", "data": {"session_id": "11091484301140930622"}}, {"op": "clear_session", "idempotency_key": "RUN-20260530-141526:11172407645040114728:clear", "data": {"session_id": "11172407645040114728"}}, {"op": "clear_session", "idempotency_key": "RUN-20260530-141526:5860122008944918375:clear", "data": {"session_id": "5860122008944918375"}}]}}