{
  "tick_id": "RUN-20260531-CRON1",
  "status": "needs_user",
  "summary": "Reconciled stale state: PRs #56 (host-template parity) + #59 (cv-fixture v2) were already merged into main but their Jules sessions were never cleared. Cleared both sessions, marked tasks DONE. Confirmed the recent notebook 'COMPLETE' was a QuickSave HTML render (801-char log, max 11.25s, no torch/training) on v42 (enable_gpu=false) — NOT a real GPU run. First submission remains gated on the user's browser 'Save & Run All (Commit)' with RTX Pro 6000 selected.",
  "actions_taken": [
    "Polled live kernel: status COMPLETE but output is log-only (no submission.zip, no adapter)",
    "Read the log: only nbconvert->HTML, 11.25s — QuickSave signature, not execution",
    "Verified notebook v42 metadata: enable_gpu=false, machine_shape=None, last_run_time 2026-05-28",
    "git fetch pull/56 + pull/59: both already ancestors of main (merged)",
    "Reconciled state: cleared 2 stale sessions, marked 2 eval tasks DONE"
  ],
  "state_patch": {
    "operations": [
      {"op": "clear_session", "idempotency_key": "RUN-20260531-CRON1:s1:clear", "data": {"session_id": "16470966891545264459"}},
      {"op": "clear_session", "idempotency_key": "RUN-20260531-CRON1:s2:clear", "data": {"session_id": "6061109906340266177"}},
      {"op": "set_status", "idempotency_key": "RUN-20260531-CRON1:t1:done", "data": {"collection": "tasks", "id": "TASK-EVAL-host-chat-template", "status": "DONE"}},
      {"op": "set_status", "idempotency_key": "RUN-20260531-CRON1:t2:done", "data": {"collection": "tasks", "id": "TASK-EVAL-cv-fixture-9cat", "status": "DONE"}},
      {"op": "update_gpu_run", "idempotency_key": "RUN-20260531-CRON1:gpu:note", "data": {"slug": "nvidia-nemotron-submission-demo", "notebook_version": 42, "latest_complete_was": "QuickSave HTML-only render (801-char log, 11.25s, no execution)", "enable_gpu_at_v42": false, "still_blocked_on": "user browser Save & Run All (Commit) with RTX Pro 6000"}},
      {"op": "append_event", "idempotency_key": "RUN-20260531-CRON1:reconcile", "data": {"merged_already": [56, 59], "sessions_cleared": ["16470966891545264459", "6061109906340266177"], "gpu_finding": "v42 COMPLETE = QuickSave HTML render, not a GPU run"}, "summary": "CRON1: reconciled 2 stale merged sessions; confirmed GPU still un-run (QuickSave)"}
    ]
  },
  "next_recommended_action": "USER: open the notebook editor, set Accelerator=NVIDIA RTX Pro 6000 + Internet ON in Session options, click 'Save & Run All (Commit)'. Operator continues v13 corpus prep (cipher solver) in parallel."
}
