{"tick_id": "CAMP-C1b", "status": "complete", "summary": "campaign cycle1b: pivot to demo-fork sai1881/nvidia-nemotron-submission-demo (T4 sm_75 RUNNING)", "state_patch": {"tick_id": "CAMP-C1b", "operations": [{"op": "clear_gpu_run", "idempotency_key": "CAMP-C1b:drop-old", "data": {"experiment_id": "nvidia-testing"}}, {"op": "record_gpu_run", "idempotency_key": "CAMP-C1b:rec-demo", "data": {"experiment_id": "nvidia-nemotron-submission-demo", "kernel_url": "https://www.kaggle.com/code/sai1881/nvidia-nemotron-submission-demo", "state": "RUNNING"}}]}}