{"tick_id": "CAMP-C11", "status": "complete", "summary": "C11: PR#55 merged (ablation configs); v26 RTX Pro 6000 ERROR cutlass.cute (user heartbeat dropped fixes); v27 reinstates them", "state_patch": {"tick_id": "CAMP-C11", "operations": [{"op": "clear_session", "idempotency_key": "CAMP-C11:9475:c", "data": {"session_id": "9475504503105628655"}}, {"op": "set_status", "idempotency_key": "CAMP-C11:ablat:d", "data": {"collection": "tasks", "id": "TASK-ABLATION-configs", "status": "DONE"}}, {"op": "update_gpu_run", "idempotency_key": "CAMP-C11:gpu", "data": {"experiment_id": "nvidia-nemotron-submission-demo", "state": "AWAITING_USER_RUN", "notebook_version": 27, "machine": "NvidiaRtxPro6000", "fix_v27": "cutlass DSL site-dir + ptxas chmod + bnb install appended to user heartbeat cell 0"}}]}}