{"tick_id": "RUN-20260530-150539b", "status": "complete", "summary": "defer cron-trigger (user controls cadence manually per prior direction)", "state_patch": {"tick_id": "RUN-20260530-150539b", "operations": [{"op": "set_status", "idempotency_key": "RUN-20260530-150539b:TASK-OPS-cron-trigger:defer", "data": {"collection": "tasks", "id": "TASK-OPS-cron-trigger", "status": "BACKLOG"}}]}}