{"tick_id": "CAMP-C18", "status": "complete", "summary": "C18: PR#60 corpus v4 force-merged (3593 verified rows \u00d7 9 cats); uploaded as Kaggle v7", "state_patch": {"tick_id": "CAMP-C18", "operations": [{"op": "clear_session", "idempotency_key": "CAMP-C18:6780:c", "data": {"session_id": "6780419095411095356"}}, {"op": "set_status", "idempotency_key": "CAMP-C18:scale:d", "data": {"collection": "tasks", "id": "TASK-CORPUS-scale-9cat", "status": "DONE"}}]}}