{"tick_id": "CAMP-C24", "status": "complete", "summary": "C24: clear 3 jules sessions; PR#61 merged; API-CPU confirmed", "state_patch": {"tick_id": "CAMP-C24", "operations": [{"op": "clear_session", "idempotency_key": "CAMP-C24:3423:c", "data": {"session_id": "3423175478610363796"}}, {"op": "set_status", "idempotency_key": "CAMP-C24:cot1:d", "data": {"collection": "tasks", "id": "TASK-DATA-cot-corpus-v1", "status": "DONE"}}, {"op": "clear_session", "idempotency_key": "CAMP-C24:1647:c", "data": {"session_id": "164709668915452644"}}, {"op": "clear_session", "idempotency_key": "CAMP-C24:6061:c", "data": {"session_id": "606110990634026617"}}, {"op": "update_gpu_run", "idempotency_key": "CAMP-C24:gpu", "data": {"experiment_id": "nvidia-nemotron-submission-demo", "state": "API_CONFIRMED_CPU_ONLY", "notebook_version": 40, "finding": "SaveAndRunAll via MCP ran on CPU even with proper fork bindings; AGENTS.md updated"}}]}}