{"tick_id": "RUN-20260530-FIRST-GPU", "status": "complete", "summary": "FIRST GPU DISPATCH: E-002 baseline pushed to Kaggle (kernel sai1881/nemotron-e-002-baseline-lora-train, ID 121111848)", "state_patch": {"tick_id": "RUN-20260530-FIRST-GPU", "operations": [{"op": "gpu_dispatch", "idempotency_key": "RUN-20260530-FIRST-GPU:E002:dispatch", "data": {"experiment_id": "E-002", "kernel_dir": "competitions/nvidia-nemotron-model-reasoning-challenge/kernels/train-baseline-e002", "owner": "sai1881", "slug": "nemotron-e-002-baseline-lora-train", "out_dir": "competitions/nvidia-nemotron-model-reasoning-challenge/experiments/E-002"}}]}}